{"schema":"solarpunk.constraint.evidence_envelope.v1","adapter":{"id":"controlled-case-fixture","version":"1.0.0"},"source":{"kind":"signed_sample_fixture","case_id":"TYN-001","sample_fixture":true,"signature_semantics":"declared_fixture_capability_not_trusted_operator_verification"},"intervals":[{"meter_id":"fixture-taoyuan_10kw","site_id":"taoyuan_10kw","window_start":"2026-05-01T00:00:00Z","window_end":"2026-05-02T00:00:00Z","generation_kwh":30,"site_load_kwh":10,"export_kwh":20,"curtailed_kwh":0,"eligible_surplus_kwh":20,"surplus_basis":"fixture_export_kwh","quality_score":1,"source":"controlled_signed_sample_fixture"},{"meter_id":"fixture-taoyuan_10kw","site_id":"taoyuan_10kw","window_start":"2026-05-02T00:00:00Z","window_end":"2026-05-03T00:00:00Z","generation_kwh":35,"site_load_kwh":10,"export_kwh":25,"curtailed_kwh":0,"eligible_surplus_kwh":25,"surplus_basis":"fixture_export_kwh","quality_score":1,"source":"controlled_signed_sample_fixture"},{"meter_id":"fixture-taoyuan_10kw","site_id":"taoyuan_10kw","window_start":"2026-05-03T00:00:00Z","window_end":"2026-05-04T00:00:00Z","generation_kwh":40,"site_load_kwh":10,"export_kwh":30,"curtailed_kwh":0,"eligible_surplus_kwh":30,"surplus_basis":"fixture_export_kwh","quality_score":1,"source":"controlled_signed_sample_fixture"},{"meter_id":"fixture-taoyuan_10kw","site_id":"taoyuan_10kw","window_start":"2026-05-04T00:00:00Z","window_end":"2026-05-05T00:00:00Z","generation_kwh":32,"site_load_kwh":10,"export_kwh":22,"curtailed_kwh":0,"eligible_surplus_kwh":22,"surplus_basis":"fixture_export_kwh","quality_score":1,"source":"controlled_signed_sample_fixture"},{"meter_id":"fixture-taoyuan_10kw","site_id":"taoyuan_10kw","window_start":"2026-05-05T00:00:00Z","window_end":"2026-05-06T00:00:00Z","generation_kwh":38,"site_load_kwh":10,"export_kwh":28,"curtailed_kwh":0,"eligible_surplus_kwh":28,"surplus_basis":"fixture_export_kwh","quality_score":1,"source":"controlled_signed_sample_fixture"},{"meter_id":"fixture-taoyuan_10kw","site_id":"taoyuan_10kw","window_start":"2026-05-06T00:00:00Z","window_end":"2026-05-07T00:00:00Z","generation_kwh":37,"site_load_kwh":10,"export_kwh":27,"curtailed_kwh":0,"eligible_surplus_kwh":27,"surplus_basis":"fixture_export_kwh","quality_score":1,"source":"controlled_signed_sample_fixture"},{"meter_id":"fixture-taoyuan_10kw","site_id":"taoyuan_10kw","window_start":"2026-05-07T00:00:00Z","window_end":"2026-05-08T00:00:00Z","generation_kwh":38,"site_load_kwh":10,"export_kwh":28,"curtailed_kwh":0,"eligible_surplus_kwh":28,"surplus_basis":"fixture_export_kwh","quality_score":1,"source":"controlled_signed_sample_fixture"}],"summary":{"interval_count":7,"total_eligible_surplus_kwh":180,"blocker_count":0,"warning_count":1,"rejected_input_records":0},"capabilities":{"identity":true,"signed":true,"cryptographically_verified":false,"signature_verification":false,"external_corroboration":false,"browser_local":true},"diagnostics":[{"code":"sample_signed_fixture","status":"WARNING","detail":"Controlled signed-capability fixture for workbench mechanics; no trusted operator identity or physical source verification is established."}],"meta":{"source_label":"TYN-001 controlled signed sample fixture","browser_local":true},"evidence_hash":"660a638c74e8f78ab7a9ed0e8f22203acdc99ad887c5b659c7b39383d305486c","hash_algorithm":"SHA-256"}
