{
  "schema": "solarpunk.constraint.evidence_envelope.v1",
  "adapter": {
    "id": "controlled-case-fixture",
    "version": "1.0.0"
  },
  "source": {
    "kind": "signed_sample_fixture",
    "case_id": "CPT-001",
    "sample_fixture": true,
    "signature_semantics": "declared_fixture_capability_not_trusted_operator_verification"
  },
  "intervals": [
    {
      "meter_id": "fixture-cape_town_10kw",
      "site_id": "cape_town_10kw",
      "window_start": "2026-11-01T00:00:00Z",
      "window_end": "2026-11-02T00:00:00Z",
      "generation_kwh": 42,
      "site_load_kwh": 10,
      "export_kwh": 32,
      "curtailed_kwh": 0,
      "eligible_surplus_kwh": 32,
      "surplus_basis": "fixture_export_kwh",
      "quality_score": 1,
      "source": "controlled_signed_sample_fixture"
    },
    {
      "meter_id": "fixture-cape_town_10kw",
      "site_id": "cape_town_10kw",
      "window_start": "2026-11-02T00:00:00Z",
      "window_end": "2026-11-03T00:00:00Z",
      "generation_kwh": 46,
      "site_load_kwh": 10,
      "export_kwh": 36,
      "curtailed_kwh": 0,
      "eligible_surplus_kwh": 36,
      "surplus_basis": "fixture_export_kwh",
      "quality_score": 1,
      "source": "controlled_signed_sample_fixture"
    },
    {
      "meter_id": "fixture-cape_town_10kw",
      "site_id": "cape_town_10kw",
      "window_start": "2026-11-03T00:00:00Z",
      "window_end": "2026-11-04T00:00:00Z",
      "generation_kwh": 44,
      "site_load_kwh": 10,
      "export_kwh": 34,
      "curtailed_kwh": 0,
      "eligible_surplus_kwh": 34,
      "surplus_basis": "fixture_export_kwh",
      "quality_score": 1,
      "source": "controlled_signed_sample_fixture"
    },
    {
      "meter_id": "fixture-cape_town_10kw",
      "site_id": "cape_town_10kw",
      "window_start": "2026-11-04T00:00:00Z",
      "window_end": "2026-11-05T00:00:00Z",
      "generation_kwh": 40,
      "site_load_kwh": 10,
      "export_kwh": 30,
      "curtailed_kwh": 0,
      "eligible_surplus_kwh": 30,
      "surplus_basis": "fixture_export_kwh",
      "quality_score": 1,
      "source": "controlled_signed_sample_fixture"
    },
    {
      "meter_id": "fixture-cape_town_10kw",
      "site_id": "cape_town_10kw",
      "window_start": "2026-11-05T00:00:00Z",
      "window_end": "2026-11-06T00:00:00Z",
      "generation_kwh": 48,
      "site_load_kwh": 10,
      "export_kwh": 38,
      "curtailed_kwh": 0,
      "eligible_surplus_kwh": 38,
      "surplus_basis": "fixture_export_kwh",
      "quality_score": 1,
      "source": "controlled_signed_sample_fixture"
    },
    {
      "meter_id": "fixture-cape_town_10kw",
      "site_id": "cape_town_10kw",
      "window_start": "2026-11-06T00:00:00Z",
      "window_end": "2026-11-07T00:00:00Z",
      "generation_kwh": 45,
      "site_load_kwh": 10,
      "export_kwh": 35,
      "curtailed_kwh": 0,
      "eligible_surplus_kwh": 35,
      "surplus_basis": "fixture_export_kwh",
      "quality_score": 1,
      "source": "controlled_signed_sample_fixture"
    },
    {
      "meter_id": "fixture-cape_town_10kw",
      "site_id": "cape_town_10kw",
      "window_start": "2026-11-07T00:00:00Z",
      "window_end": "2026-11-08T00:00:00Z",
      "generation_kwh": 45,
      "site_load_kwh": 10,
      "export_kwh": 35,
      "curtailed_kwh": 0,
      "eligible_surplus_kwh": 35,
      "surplus_basis": "fixture_export_kwh",
      "quality_score": 1,
      "source": "controlled_signed_sample_fixture"
    }
  ],
  "summary": {
    "interval_count": 7,
    "total_eligible_surplus_kwh": 240,
    "blocker_count": 0,
    "warning_count": 1,
    "rejected_input_records": 0
  },
  "capabilities": {
    "identity": true,
    "signed": true,
    "cryptographically_verified": false,
    "signature_verification": false,
    "external_corroboration": false,
    "browser_local": true
  },
  "diagnostics": [
    {
      "code": "sample_signed_fixture",
      "status": "WARNING",
      "detail": "Controlled signed-capability fixture for workbench mechanics; no trusted operator identity or physical source verification is established."
    }
  ],
  "meta": {
    "source_label": "CPT-001 controlled signed sample fixture",
    "browser_local": true
  },
  "evidence_hash": "1e71694271b0f05430a6d24b10692af4714cf6d520858603eb6892554ad2548a",
  "hash_algorithm": "SHA-256"
}
