{"schema":"solarpunk.constraint.evidence_envelope.v1","adapter":{"id":"controlled-case-fixture","version":"1.0.0"},"source":{"kind":"signed_sample_fixture","case_id":"AUS-001","sample_fixture":true,"signature_semantics":"declared_fixture_capability_not_trusted_operator_verification"},"intervals":[{"meter_id":"fixture-austin_10kw","site_id":"austin_10kw","window_start":"2026-05-01T00:00:00Z","window_end":"2026-05-02T00:00:00Z","generation_kwh":80,"site_load_kwh":10,"export_kwh":70,"curtailed_kwh":0,"eligible_surplus_kwh":70,"surplus_basis":"fixture_export_kwh","quality_score":1,"source":"controlled_signed_sample_fixture"},{"meter_id":"fixture-austin_10kw","site_id":"austin_10kw","window_start":"2026-05-02T00:00:00Z","window_end":"2026-05-03T00:00:00Z","generation_kwh":82,"site_load_kwh":10,"export_kwh":72,"curtailed_kwh":0,"eligible_surplus_kwh":72,"surplus_basis":"fixture_export_kwh","quality_score":1,"source":"controlled_signed_sample_fixture"},{"meter_id":"fixture-austin_10kw","site_id":"austin_10kw","window_start":"2026-05-03T00:00:00Z","window_end":"2026-05-04T00:00:00Z","generation_kwh":78,"site_load_kwh":10,"export_kwh":68,"curtailed_kwh":0,"eligible_surplus_kwh":68,"surplus_basis":"fixture_export_kwh","quality_score":1,"source":"controlled_signed_sample_fixture"},{"meter_id":"fixture-austin_10kw","site_id":"austin_10kw","window_start":"2026-05-04T00:00:00Z","window_end":"2026-05-05T00:00:00Z","generation_kwh":85,"site_load_kwh":10,"export_kwh":75,"curtailed_kwh":0,"eligible_surplus_kwh":75,"surplus_basis":"fixture_export_kwh","quality_score":1,"source":"controlled_signed_sample_fixture"},{"meter_id":"fixture-austin_10kw","site_id":"austin_10kw","window_start":"2026-05-05T00:00:00Z","window_end":"2026-05-06T00:00:00Z","generation_kwh":84,"site_load_kwh":10,"export_kwh":74,"curtailed_kwh":0,"eligible_surplus_kwh":74,"surplus_basis":"fixture_export_kwh","quality_score":1,"source":"controlled_signed_sample_fixture"},{"meter_id":"fixture-austin_10kw","site_id":"austin_10kw","window_start":"2026-05-06T00:00:00Z","window_end":"2026-05-07T00:00:00Z","generation_kwh":81,"site_load_kwh":10,"export_kwh":71,"curtailed_kwh":0,"eligible_surplus_kwh":71,"surplus_basis":"fixture_export_kwh","quality_score":1,"source":"controlled_signed_sample_fixture"},{"meter_id":"fixture-austin_10kw","site_id":"austin_10kw","window_start":"2026-05-07T00:00:00Z","window_end":"2026-05-08T00:00:00Z","generation_kwh":80,"site_load_kwh":10,"export_kwh":70,"curtailed_kwh":0,"eligible_surplus_kwh":70,"surplus_basis":"fixture_export_kwh","quality_score":1,"source":"controlled_signed_sample_fixture"}],"summary":{"interval_count":7,"total_eligible_surplus_kwh":500,"blocker_count":0,"warning_count":1,"rejected_input_records":0},"capabilities":{"identity":true,"signed":true,"cryptographically_verified":false,"signature_verification":false,"external_corroboration":false,"browser_local":true},"diagnostics":[{"code":"sample_signed_fixture","status":"WARNING","detail":"Controlled signed-capability fixture for workbench mechanics; no trusted operator identity or physical source verification is established."}],"meta":{"source_label":"AUS-001 controlled signed sample fixture","browser_local":true},"evidence_hash":"4c41a3adf01fc0bf191576f5fe90fe4748f5d8e0b962f1e97f88f1e03984de6f","hash_algorithm":"SHA-256"}
