{"schema":"solarpunk.constraint.evidence_envelope.v1","adapter":{"id":"controlled-case-fixture","version":"1.0.0"},"source":{"kind":"signed_sample_fixture","case_id":"PHX-001","sample_fixture":true,"signature_semantics":"declared_fixture_capability_not_trusted_operator_verification"},"intervals":[{"meter_id":"fixture-phoenix_10kw","site_id":"phoenix_10kw","window_start":"2026-05-01T00:00:00Z","window_end":"2026-05-02T00:00:00Z","generation_kwh":55,"site_load_kwh":10,"export_kwh":45,"curtailed_kwh":0,"eligible_surplus_kwh":45,"surplus_basis":"fixture_export_kwh","quality_score":1,"source":"controlled_signed_sample_fixture"},{"meter_id":"fixture-phoenix_10kw","site_id":"phoenix_10kw","window_start":"2026-05-02T00:00:00Z","window_end":"2026-05-03T00:00:00Z","generation_kwh":56,"site_load_kwh":10,"export_kwh":46,"curtailed_kwh":0,"eligible_surplus_kwh":46,"surplus_basis":"fixture_export_kwh","quality_score":1,"source":"controlled_signed_sample_fixture"},{"meter_id":"fixture-phoenix_10kw","site_id":"phoenix_10kw","window_start":"2026-05-03T00:00:00Z","window_end":"2026-05-04T00:00:00Z","generation_kwh":54,"site_load_kwh":10,"export_kwh":44,"curtailed_kwh":0,"eligible_surplus_kwh":44,"surplus_basis":"fixture_export_kwh","quality_score":1,"source":"controlled_signed_sample_fixture"},{"meter_id":"fixture-phoenix_10kw","site_id":"phoenix_10kw","window_start":"2026-05-04T00:00:00Z","window_end":"2026-05-05T00:00:00Z","generation_kwh":57,"site_load_kwh":10,"export_kwh":47,"curtailed_kwh":0,"eligible_surplus_kwh":47,"surplus_basis":"fixture_export_kwh","quality_score":1,"source":"controlled_signed_sample_fixture"},{"meter_id":"fixture-phoenix_10kw","site_id":"phoenix_10kw","window_start":"2026-05-05T00:00:00Z","window_end":"2026-05-06T00:00:00Z","generation_kwh":55,"site_load_kwh":10,"export_kwh":45,"curtailed_kwh":0,"eligible_surplus_kwh":45,"surplus_basis":"fixture_export_kwh","quality_score":1,"source":"controlled_signed_sample_fixture"},{"meter_id":"fixture-phoenix_10kw","site_id":"phoenix_10kw","window_start":"2026-05-06T00:00:00Z","window_end":"2026-05-07T00:00:00Z","generation_kwh":56,"site_load_kwh":10,"export_kwh":46,"curtailed_kwh":0,"eligible_surplus_kwh":46,"surplus_basis":"fixture_export_kwh","quality_score":1,"source":"controlled_signed_sample_fixture"},{"meter_id":"fixture-phoenix_10kw","site_id":"phoenix_10kw","window_start":"2026-05-07T00:00:00Z","window_end":"2026-05-08T00:00:00Z","generation_kwh":57,"site_load_kwh":10,"export_kwh":47,"curtailed_kwh":0,"eligible_surplus_kwh":47,"surplus_basis":"fixture_export_kwh","quality_score":1,"source":"controlled_signed_sample_fixture"}],"summary":{"interval_count":7,"total_eligible_surplus_kwh":320,"blocker_count":0,"warning_count":1,"rejected_input_records":0},"capabilities":{"identity":true,"signed":true,"cryptographically_verified":false,"signature_verification":false,"live_gateway_candidate":true,"external_corroboration":false,"browser_local":true},"diagnostics":[{"code":"sample_signed_fixture","status":"WARNING","detail":"Controlled signed-capability fixture for workbench mechanics; no trusted operator identity or physical source verification is established."}],"meta":{"source_label":"PHX-001 controlled signed sample fixture","browser_local":true},"evidence_hash":"efefcb972c66d4058e04e53bf06c7a32f0e827a089cf631241d1d916beb932e6","hash_algorithm":"SHA-256"}
